### ISSUE TITLE
Installing Plugin via Proxy fails (ES 2.4.1)

### ISSUE THREAD

**Issue by rlueckl** [elastic/elasticsearch#21824]
This is a follow up of https://discuss.elastic.co/t/installing-plugins-via-proxy-doesnt-work-anymore/61901

**Elasticsearch version**: 2.4.1

**JVM version**: Oracle Java 1.8.0_66

**OS version**: Debian Wheezy

**Description of the problem including expected versus actual behavior**: I'm trying to install the "mobz/elasticsearch-head" plugin through a proxy, but I always get a "SocketTimeoutException". I've used a proxy before (via -DproxyPort and -DproxyHost) and it has worked in an earlier version (don't know the exact version, but you had to use "./plugin -install" before, now it's just "./plugin install").

**Steps to reproduce**:
```
/usr/share/elasticsearch/bin/plugin -DproxyHost=http://my.proxy.lan -DproxyPort=3128 install mobz/elasticsearch-head --verbose
```

**Provide logs (if relevant)**:
```
-> Installing mobz/elasticsearch-head...
Trying https://github.com/mobz/elasticsearch-head/archive/master.zip ...
Failed: SocketTimeoutException[connect timed out]
ERROR: failed to download out of all possible locations..., use --verbose to get detailed information
```

Using the same proxy and wget I can download the file:

```
https_proxy=http://my.proxy.lan:3128 wget https://github.com/mobz/elasticsearch-head/archive/master.zip
--2016-11-28 12:39:57--  https://github.com/mobz/elasticsearch-head/archive/master.zip
Resolving my.proxy.lan (my.proxy.lan)... 172.xx.xx.xx
Connecting to my.proxy.lan (my.proxy.lan)|172.xx.xx.xx|:3128... connected.
Proxy request sent, awaiting response... 302 Found
Location: https://codeload.github.com/mobz/elasticsearch-head/zip/master [following]
--2016-11-28 12:39:58--  https://codeload.github.com/mobz/elasticsearch-head/zip/master
Connecting to my.proxy.lan (my.proxy.lan)|172.xx.xx.xx|:3128... connected.
Proxy request sent, awaiting response... 200 OK
Length: 907315 (886K) [application/zip]
Saving to: `master.zip'

100%[==========================>] 907,315     1.28M/s   in 0.7s    

2016-11-28 12:40:00 (1.28 MB/s) - `master.zip' saved [907315/907315]
```

**Comment by jasontedor** [comment]
I think that you have proxy host and proxy port backwards. Your command shows: 

```
-DproxyPort=http://my.proxy.lan -DproxyHost=3128
```

You have the hostname where the port goes and the port where the hostname goes.

**Comment by rlueckl** [comment]
Sorry, that's just a copy-paste error. I corrected it.

**Comment by jasontedor** [comment]
I'm not sure if the system property is correct to begin with. Would you please try `-Dhttps.proxyHost` and `-Dhttps.proxyPost` instead of `-DproxyHost` and `-DproxyPort`?

**Comment by rlueckl** [comment]
I tried those too, no luck:

```
root@****:/usr/share/elasticsearch/bin# ./plugin -Dhttps.proxyHost=http://my.proxy.lan -Dhttps.proxyPost=3128 install mobz/elasticsearch-head --verbose
-> Installing mobz/elasticsearch-head...
Trying https://github.com/mobz/elasticsearch-head/archive/master.zip ...
Failed: SocketTimeoutException[connect timed out]
ERROR: failed to download out of all possible locations..., use --verbose to get detailed information
root@****:/usr/share/elasticsearch/bin# 
```

You can take a look at the link I posted in the discussion forums (see above). I've basically tried every variant I could find, none of them worked.

**Comment by rlueckl** [comment]
@jasontedor Feedback given. Unfortunately I can't seem to remove the label. ;)

**Comment by jasontedor** [comment]
I think this is on your end. I'm able to get this working with a proxy and using `-Dhttps.proxyHost` and `-Dhttps.proxyPort`:

```
[vagrant@localhost ~]$ ES_JAVA_OPTS="-Dhttps.proxyHost=localhost -Dhttps.proxyPort=443" ~/elasticsearch/elasticsearch-5.1.1/bin/elasticsearch-plugin install x-pack
-> Downloading x-pack from elastic
[=================================================] 100%   
@@@@@@@@@@@@@@@@@@@@@@@@@@@@@@@@@@@@@@@@@@@@@@@@@@@@@@@@@@@
@     WARNING: plugin requires additional permissions     @
@@@@@@@@@@@@@@@@@@@@@@@@@@@@@@@@@@@@@@@@@@@@@@@@@@@@@@@@@@@
* java.lang.RuntimePermission accessClassInPackage.com.sun.activation.registries
* java.lang.RuntimePermission getClassLoader
* java.lang.RuntimePermission setContextClassLoader
* java.lang.RuntimePermission setFactory
* java.security.SecurityPermission createPolicy.JavaPolicy
* java.security.SecurityPermission getPolicy
* java.security.SecurityPermission putProviderProperty.BC
* java.security.SecurityPermission setPolicy
* java.util.PropertyPermission * read,write
* java.util.PropertyPermission sun.nio.ch.bugLevel write
* javax.net.ssl.SSLPermission setHostnameVerifier
See http://docs.oracle.com/javase/8/docs/technotes/guides/security/permissions.html
for descriptions of what these permissions allow and the associated risks.

Continue with installation? [y/N]y
-> Installed x-pack
[vagrant@localhost ~]$ 
```

Output from my proxy:

```
>> GET https://artifacts.elastic.co/downloads/elasticsearch-plugins/x-pack/x-pack-5.1.1.zip                                                                                                                                                                                                                    
       ← 200 application/zip 14.71m 3.32s                                                                                                                                                                                                                                                                      
   GET https://artifacts.elastic.co/downloads/elasticsearch-plugins/x-pack/x-pack-5.1.1.zip.sha1                                                                                                                                                                                                               
       ← 200 application/octet-stream 40b 80ms    
```

**Comment by rlueckl** [comment]
But why was it working with versions < 2.4? Why does the proxy work with wget and curl?

I don't really understand Java, but when I use curl I see that the first request is a CONNECT to the proxy, and not a GET request. Maybe that's relevant?

As you can see from my example we only have an HTTP port for the proxy (Squid) on Port 3128. We don't have a separate HTTPS proxy. Maybe you have to use CONNECT?

```
root@server:~# curl -v -x http://my.proxy.lan:3128 https://artifacts.elastic.co/downloads/elasticsearch-plugins/x-pack/x-pack-5.1.1.zip
* About to connect() to proxy my.proxy.lan port 3128 (#0)
*   Trying 172.xx.xx.xx...
* connected
* Connected to my.proxy.lan (172.xx.xx.xx) port 3128 (#0)
* Establish HTTP proxy tunnel to artifacts.elastic.co:443
> CONNECT artifacts.elastic.co:443 HTTP/1.1
> Host: artifacts.elastic.co:443
> User-Agent: curl/7.26.0
> Proxy-Connection: Keep-Alive
> 
* Easy mode waiting response from proxy CONNECT
< HTTP/1.1 200 Connection established
< 
* Proxy replied OK to CONNECT request
* successfully set certificate verify locations:
*   CAfile: none
  CApath: /etc/ssl/certs
* SSLv3, TLS handshake, Client hello (1):
* SSLv3, TLS handshake, Server hello (2):
* SSLv3, TLS handshake, CERT (11):
* SSLv3, TLS handshake, Server key exchange (12):
* SSLv3, TLS handshake, Server finished (14):
* SSLv3, TLS handshake, Client key exchange (16):
* SSLv3, TLS change cipher, Client hello (1):
* SSLv3, TLS handshake, Finished (20):
* SSLv3, TLS change cipher, Client hello (1):
* SSLv3, TLS handshake, Finished (20):
* SSL connection using ECDHE-RSA-AES128-GCM-SHA256
* Server certificate:
* 	 subject: C=US; ST=California; L=Mountain View; O=Elasticsearch, Inc.; CN=*.elastic.co
* 	 start date: 2016-01-18 00:00:00 GMT
* 	 expire date: 2019-03-27 12:00:00 GMT
* 	 subjectAltName: artifacts.elastic.co matched
* 	 issuer: C=US; O=DigiCert Inc; CN=DigiCert SHA2 Secure Server CA
* 	 SSL certificate verify ok.
> GET /downloads/elasticsearch-plugins/x-pack/x-pack-5.1.1.zip HTTP/1.1
> User-Agent: curl/7.26.0
> Host: artifacts.elastic.co
> Accept: */*
> 
* additional stuff not fine transfer.c:1037: 0 0
* HTTP 1.1 or later with persistent connection, pipelining supported
< HTTP/1.1 200 OK
< Accept-Ranges: bytes
< Content-Type: application/zip
< Date: Wed, 28 Dec 2016 08:50:04 GMT
< ETag: "7e199b8bcd95b6020f82c4b4164474d0"
< Last-Modified: Thu, 08 Dec 2016 16:12:29 GMT
< Server: nginx/1.4.6 (Ubuntu)
< x-amz-id-2: WM1i0LOB2tDkHmQD2QL1GjqjTEAZijoFCVbDDzroOHcMu3eiLC/WTkOg+VT2KBgxvX1aQ6WYN9M=
< x-amz-request-id: 0F270E38C7EBC629
< x-amz-version-id: x8as8cd9PdukYwQsHzrGIKsMi51k9Ks.
< x-ngx-hostname: www01
< Content-Length: 15423088
< Connection: keep-alive
```

**Comment by jasontedor** [comment]
> I don't really understand Java, but when I use curl I see that the first request is a CONNECT to the proxy, and not a GET request. Maybe that's relevant?

> As you can see from my example we only have an HTTP port for the proxy (Squid) on Port 3128. We don't have a separate HTTPS proxy. Maybe you have to use CONNECT?

It does do a `CONNECT`, that's part of the [proxy protocol](https://en.wikipedia.org/wiki/HTTP_tunnel#HTTP_CONNECT_tunneling) for connecting to a site using SSL through an HTTP proxy. You can see this if you `tcpdump` traffic on the proxy port (here I put a plain HTTP proxy listening on localhost port 3128):

```
[vagrant@localhost ~]$ sudo tcpdump -nnvXSs 0 -i lo port 3128                                                                                                                                                                                                                                                                       [9/9]
tcpdump: listening on lo, link-type EN10MB (Ethernet), capture size 262144 bytes
15:53:58.831270 IP (tos 0x0, ttl 64, id 36332, offset 0, flags [DF], proto TCP (6), length 60)
    127.0.0.1.45066 > 127.0.0.1.3128: Flags [S], cksum 0xfe30 (incorrect -> 0x0bfd), seq 450564612, win 43690, options [mss 65495,sackOK,TS val 271097832 ecr 0,nop,wscale 7], length 0
        0x0000:  4500 003c 8dec 4000 4006 aecd 7f00 0001  E..<..@.@.......
        0x0010:  7f00 0001 b00a 0c38 1adb 1204 0000 0000  .......8........
        0x0020:  a002 aaaa fe30 0000 0204 ffd7 0402 080a  .....0..........
        0x0030:  1028 9fe8 0000 0000 0103 0307            .(..........
15:53:58.831283 IP (tos 0x0, ttl 64, id 0, offset 0, flags [DF], proto TCP (6), length 60)
    127.0.0.1.3128 > 127.0.0.1.45066: Flags [S.], cksum 0xfe30 (incorrect -> 0x7067), seq 1834188320, ack 450564613, win 43690, options [mss 65495,sackOK,TS val 271097832 ecr 271097832,nop,wscale 7], length 0
        0x0000:  4500 003c 0000 4000 4006 3cba 7f00 0001  E..<..@.@.<.....
        0x0010:  7f00 0001 0c38 b00a 6d53 7e20 1adb 1205  .....8..mS~.....
        0x0020:  a012 aaaa fe30 0000 0204 ffd7 0402 080a  .....0..........
        0x0030:  1028 9fe8 1028 9fe8 0103 0307            .(...(......
15:53:58.831291 IP (tos 0x0, ttl 64, id 36333, offset 0, flags [DF], proto TCP (6), length 52)
    127.0.0.1.45066 > 127.0.0.1.3128: Flags [.], cksum 0xfe28 (incorrect -> 0x42ac), ack 1834188321, win 342, options [nop,nop,TS val 271097832 ecr 271097832], length 0
        0x0000:  4500 0034 8ded 4000 4006 aed4 7f00 0001  E..4..@.@.......
        0x0010:  7f00 0001 b00a 0c38 1adb 1205 6d53 7e21  .......8....mS~!
        0x0020:  8010 0156 fe28 0000 0101 080a 1028 9fe8  ...V.(.......(..
        0x0030:  1028 9fe8                                .(..
15:53:58.834027 IP (tos 0x0, ttl 64, id 36334, offset 0, flags [DF], proto TCP (6), length 245)
    127.0.0.1.45066 > 127.0.0.1.3128: Flags [P.], cksum 0xfee9 (incorrect -> 0xef23), seq 450564613:450564806, ack 1834188321, win 342, options [nop,nop,TS val 271097834 ecr 271097832], length 193
        0x0000:  4500 00f5 8dee 4000 4006 ae12 7f00 0001  E.....@.@.......
        0x0010:  7f00 0001 b00a 0c38 1adb 1205 6d53 7e21  .......8....mS~!
        0x0020:  8018 0156 fee9 0000 0101 080a 1028 9fea  ...V.........(..
        0x0030:  1028 9fe8 434f 4e4e 4543 5420 6172 7469  .(..CONNECT.arti
        0x0040:  6661 6374 732e 656c 6173 7469 632e 636f  facts.elastic.co
        0x0050:  3a34 3433 2048 5454 502f 312e 310d 0a55  :443.HTTP/1.1..U
        0x0060:  7365 722d 4167 656e 743a 204a 6176 612f  ser-Agent:.Java/
        0x0070:  312e 382e 305f 3131 320d 0a48 6f73 743a  1.8.0_112..Host:
        0x0080:  2061 7274 6966 6163 7473 2e65 6c61 7374  .artifacts.elast
        0x0090:  6963 2e63 6f0d 0a41 6363 6570 743a 2074  ic.co..Accept:.t
        0x00a0:  6578 742f 6874 6d6c 2c20 696d 6167 652f  ext/html,.image/
        0x00b0:  6769 662c 2069 6d61 6765 2f6a 7065 672c  gif,.image/jpeg,
        0x00c0:  202a 3b20 713d 2e32 2c20 2a2f 2a3b 2071  .*;.q=.2,.*/*;.q
        0x00d0:  3d2e 320d 0a50 726f 7879 2d43 6f6e 6e65  =.2..Proxy-Conne
        0x00e0:  6374 696f 6e3a 206b 6565 702d 616c 6976  ction:.keep-aliv
        0x00f0:  650d 0a0d 0a                             e....
```

**Comment by hcguersoy** [comment]
Just wanted to mention that I've the same error behavior as @rlueckl here, too.

This is observed on a Docker image based on Ubuntu 16.04, OpenJDK 1.8.0_111, Elasticsearch 2.4.1 and 2.4.3. 
This is really annoying as this has worked with previous versions w/o problems, access using curl or wget through the proxy is no problem.

**Comment by rlueckl** [comment]
Just a quick update: I also tried 5.1.1 and it works with the following line:

```
$ ES_JAVA_OPTS="-Dhttps.proxyHost=my.proxy.lan -Dhttps.proxyPort=3128" /usr/share/elasticsearch/bin/elasticsearch-plugin install x-pack
```

**Comment by hcguersoy** [comment]
@rlueckl thanks for the update

As we've currently stick to 2.4.x I workarounded this by downloading the plugins initially by wget and installing them from the downloaded files.

**Comment by jasontedor** [comment]
@rlueckl I'm confused, that's what I showed in my [example](https://github.com/elastic/elasticsearch/issues/21824#issuecomment-269401462) last week? I'm asking this because I want to know what we could have done to get you to a solution more quickly? This also leads me to believe that our docs need improvement here. I welcome your feedback here.

**Comment by hcguersoy** [comment]
@jasontedor  Maybe this is because @rlueckl and me used ES 2.4.x? 

You've done it with ES 5.1.1.:

```
[vagrant@localhost ~]$ ES_JAVA_OPTS="-Dhttps.proxyHost=localhost -Dhttps.proxyPort=443" ~/elasticsearch/elasticsearch-5.1.1/bin/elasticsearch-plugin install x-pack
```

**Comment by jasontedor** [comment]
That should not make any difference whatsoever but I will investigate to be sure.

**Comment by jasontedor** [comment]
This worked fine for me on 2.4.3 (note the placement of `-Dhttps.proxyHost=localhost -Dhttps.proxyPort=8888` is different than in 5.x because the plugin script does not respect `ES_JAVA_OPTS` in 2.x):

```bash
[vagrant@localhost ~]$ ~/elasticsearch-2.4.3/bin/plugin -Dhttps.proxyHost=localhost -Dhttps.proxyPort=8888 install marvel-agent
-> Installing marvel-agent...
Trying https://download.elastic.co/elasticsearch/release/org/elasticsearch/plugin/marvel-agent/2.4.3/marvel-agent-2.4.3.zip ...
Downloading ..........DONE
Verifying https://download.elastic.co/elasticsearch/release/org/elasticsearch/plugin/marvel-agent/2.4.3/marvel-agent-2.4.3.zip checksums if available ...
Downloading .DONE
@@@@@@@@@@@@@@@@@@@@@@@@@@@@@@@@@@@@@@@@@@@@@@@@@@@@@@@@@@@
@     WARNING: plugin requires additional permissions     @
@@@@@@@@@@@@@@@@@@@@@@@@@@@@@@@@@@@@@@@@@@@@@@@@@@@@@@@@@@@
* java.lang.RuntimePermission setFactory
* javax.net.ssl.SSLPermission setHostnameVerifier
See http://docs.oracle.com/javase/8/docs/technotes/guides/security/permissions.html
for descriptions of what these permissions allow and the associated risks.

Continue with installation? [y/N]y
Installed marvel-agent into /home/vagrant/elasticsearch-2.4.3/plugins/marvel-agent
[vagrant@localhost ~]$ 
```

and the output from `tcpdump` verifying we went through the proxy:

```bash
[vagrant@localhost ~]$ sudo tcpdump -nnvXSs 0 -i lo port 8888
tcpdump: listening on lo, link-type EN10MB (Ethernet), capture size 262144 bytes
16:10:18.176662 IP (tos 0x0, ttl 64, id 9483, offset 0, flags [DF], proto TCP (6), length 60)
    127.0.0.1.50912 > 127.0.0.1.8888: Flags [S], cksum 0xfe30 (incorrect -> 0xd54b), seq 2617751186, win 43690, options [mss 65495,sackOK,TS val 1545113 ecr 0,nop,wscale 7], length 0
	0x0000:  4500 003c 250b 4000 4006 17af 7f00 0001  E..<%.@.@.......
	0x0010:  7f00 0001 c6e0 22b8 9c07 b692 0000 0000  ......".........
	0x0020:  a002 aaaa fe30 0000 0204 ffd7 0402 080a  .....0..........
	0x0030:  0017 9399 0000 0000 0103 0307            ............
16:10:18.176676 IP (tos 0x0, ttl 64, id 0, offset 0, flags [DF], proto TCP (6), length 60)
    127.0.0.1.8888 > 127.0.0.1.50912: Flags [S.], cksum 0xfe30 (incorrect -> 0x316c), seq 3359524830, ack 2617751187, win 43690, options [mss 65495,sackOK,TS val 1545114 ecr 1545113,nop,wscale 7], length 0
	0x0000:  4500 003c 0000 4000 4006 3cba 7f00 0001  E..<..@.@.<.....
	0x0010:  7f00 0001 22b8 c6e0 c83e 47de 9c07 b693  ...."....>G.....
	0x0020:  a012 aaaa fe30 0000 0204 ffd7 0402 080a  .....0..........
	0x0030:  0017 939a 0017 9399 0103 0307            ............
16:10:18.176686 IP (tos 0x0, ttl 64, id 9484, offset 0, flags [DF], proto TCP (6), length 52)
    127.0.0.1.50912 > 127.0.0.1.8888: Flags [.], cksum 0xfe28 (incorrect -> 0x03b0), ack 3359524831, win 342, options [nop,nop,TS val 1545114 ecr 1545114], length 0
	0x0000:  4500 0034 250c 4000 4006 17b6 7f00 0001  E..4%.@.@.......
	0x0010:  7f00 0001 c6e0 22b8 9c07 b693 c83e 47df  ......"......>G.
	0x0020:  8010 0156 fe28 0000 0101 080a 0017 939a  ...V.(..........
	0x0030:  0017 939a                                ....
16:10:18.177610 IP (tos 0x0, ttl 64, id 9485, offset 0, flags [DF], proto TCP (6), length 243)
    127.0.0.1.50912 > 127.0.0.1.8888: Flags [P.], cksum 0xfee7 (incorrect -> 0x5657), seq 2617751187:2617751378, ack 3359524831, win 342, options [nop,nop,TS val 1545115 ecr 1545114], length 191
	0x0000:  4500 00f3 250d 4000 4006 16f6 7f00 0001  E...%.@.@.......
	0x0010:  7f00 0001 c6e0 22b8 9c07 b693 c83e 47df  ......"......>G.
	0x0020:  8018 0156 fee7 0000 0101 080a 0017 939b  ...V............
	0x0030:  0017 939a 434f 4e4e 4543 5420 646f 776e  ....CONNECT.down
	0x0040:  6c6f 6164 2e65 6c61 7374 6963 2e63 6f3a  load.elastic.co:
	0x0050:  3434 3320 4854 5450 2f31 2e31 0d0a 5573  443.HTTP/1.1..Us
	0x0060:  6572 2d41 6765 6e74 3a20 4a61 7661 2f31  er-Agent:.Java/1
	0x0070:  2e38 2e30 5f31 3132 0d0a 486f 7374 3a20  .8.0_112..Host:.
	0x0080:  646f 776e 6c6f 6164 2e65 6c61 7374 6963  download.elastic
	0x0090:  2e63 6f0d 0a41 6363 6570 743a 2074 6578  .co..Accept:.tex
	0x00a0:  742f 6874 6d6c 2c20 696d 6167 652f 6769  t/html,.image/gi
	0x00b0:  662c 2069 6d61 6765 2f6a 7065 672c 202a  f,.image/jpeg,.*
	0x00c0:  3b20 713d 2e32 2c20 2a2f 2a3b 2071 3d2e  ;.q=.2,.*/*;.q=.
	0x00d0:  320d 0a50 726f 7879 2d43 6f6e 6e65 6374  2..Proxy-Connect
	0x00e0:  696f 6e3a 206b 6565 702d 616c 6976 650d  ion:.keep-alive.
	0x00f0:  0a0d 0a                                  ...
16:10:18.177616 IP (tos 0x0, ttl 64, id 54341, offset 0, flags [DF], proto TCP (6), length 52)
    127.0.0.1.8888 > 127.0.0.1.50912: Flags [.], cksum 0xfe28 (incorrect -> 0x02e7), ack 2617751378, win 350, options [nop,nop,TS val 1545115 ecr 1545115], length 0
	0x0000:  4500 0034 d445 4000 4006 687c 7f00 0001  E..4.E@.@.h|....
	0x0010:  7f00 0001 22b8 c6e0 c83e 47df 9c07 b752  ...."....>G....R
	0x0020:  8010 015e fe28 0000 0101 080a 0017 939b  ...^.(..........
	0x0030:  0017 939b                                ....
```

**Comment by rlueckl** [comment]
I think I've found the problem... If that's really it, I'm very sorry for all the confusion!

It also works with 2.4.1 (tested right now).

The problem was, that I've used `-Dhttps.proxyHost=http://my.proxy.lan` in my tests instead of `-Dhttps.proxyHost=my.proxy.lan` (see https://discuss.elastic.co/t/installing-plugins-via-proxy-doesnt-work-anymore/61901).

@jasontedor your first comment on this issue also used the "http://" prefix so that's what I was trying all the time. But apparently that's the problem. The value of `-Dhttps.proxyHost` has to be the hostname+domain **only**.

This works for 2.4.x (tested with 2.4.1): `root@server:/usr/share/elasticsearch/bin# ./plugin -Dhttps.proxyHost=my.proxy.lan -Dhttps.proxyPort=3128 install marvel-agent`
This works for 5.x (tested with 5.1.1): `root@server:/usr/share/elasticsearch/bin# ES_JAVA_OPTS="-Dhttps.proxyHost=my.proxy.lan -Dhttps.proxyPort=3128" ./elasticsearch-plugin install x-pack`

@hcguersoy Can you confirm?

**Comment by jasontedor** [comment]
> I think I've found the problem... If that's really it, I'm very sorry for all the confusion!

I'm really happy to hear this.

> @jasontedor your first comment on this issue also used the "http://" prefix, and @dadoonet used it in his comment too, so that's what I was trying all the time. But apparently that's the problem. The value of `-Dhttps.proxyHost` has to be the hostname+domain **only**.

In my first comment I was merely showing that you initially had proxy host and proxy port swapped and not looking any more closely than that since that seemed pretty obvious to me to be a problem. I will take this as a lesson-learned for me (don't just point out what might be wrong, but point out the right way). :smile:
