### ISSUE TITLE
Clients fail to connect to Elasticsearch over https when elasticsearch uses EC private keys and certificates stored in PEM files

### ISSUE THREAD

**Issue by derickson** [elastic/elasticsearch#55031]
**Elasticsearch version** (`bin/elasticsearch --version`): Version: 7.6.1, Build: default/tar/aa751e09be0a5072e8570670309b1f12348f023b/2020-02-29T00:15:25.529771Z, JVM: 13.0.2

**Plugins installed**: []

**JVM version** (`java -version`): JVM[Oracle Corporation/Java HotSpot(TM) 64-Bit Server VM/13.0.2/13.0.2+8]

**OS version** (`uname -a` if on a Unix-like system): OS[Linux/3.10.0-1062.9.1.el7.x86_64/amd64]

**Description of the problem including expected versus actual behavior**:
Clients ( `curl` , `openssl s_client` ) fail to connect to Elasticsearch when elasticsearch uses EC key material for TLS. Clients fail to complete the TLS handshake

**Comment by jkakavas** [comment]
. The handshake fails after the server sends the message containing `Server hello`, `Change Cipher Spec` and `Application Data` , to which the client ( `curl` or `openssl s_client` ) reply with  an `Alert` with `Fatal` level and an `Illegal Parameter` description. The packet looks like this :
```
No.     Time           Source                Destination           Protocol Length Info
    344 3127.283492864 127.0.0.1             127.0.0.1             TLSv1.3  75     Alert (Level: Fatal, Description: Illegal Parameter)

Frame 344: 75 bytes on wire (600 bits), 75 bytes captured (600 bits) on interface 0
Linux cooked capture
Internet Protocol Version 4, Src: 127.0.0.1, Dst: 127.0.0.1
Transmission Control Protocol, Src Port: 50120, Dst Port: 9200, Seq: 518, Ack: 932, Len: 7
Transport Layer Security
    TLSv1.3 Record Layer: Alert (Level: Fatal, Description: Illegal Parameter)
        Content Type: Alert (21)
        Version: TLS 1.2 (0x0303)
        Length: 2
        Alert Message
            Level: Fatal (2)
            Description: Illegal Parameter (47)
```

The problem manifests when EC key and certificates are used for the key material in elasticsearch AND these are configured as PEM files. The same key material added in a keystore work fine and other types of keys (i.e. RSA ) work fine for key material configured as PEM files.

Interestingly the server hello when using a keystore ( which doesn't cause the failure ) and when using the pem files ( which cause the error ) are not that different. 

##### Server hello that causes client to fail
```
No.     Time           Source                Destination           Protocol Length Info
    342 3127.283029102 127.0.0.1             127.0.0.1             TLSv1.3  999    Server Hello, Change Cipher Spec, Application Data

Frame 342: 999 bytes on wire (7992 bits), 999 bytes captured (7992 bits) on interface 0
Linux cooked capture
Internet Protocol Version 4, Src: 127.0.0.1, Dst: 127.0.0.1
Transmission Control Protocol, Src Port: 9200, Dst Port: 50120, Seq: 1, Ack: 518, Len: 931
Transport Layer Security
    TLSv1.3 Record Layer: Handshake Protocol: Server Hello
        Content Type: Handshake (22)
        Version: TLS 1.2 (0x0303)
        Length: 122
        Handshake Protocol: Server Hello
            Handshake Type: Server Hello (2)
            Length: 118
            Version: TLS 1.2 (0x0303)
            Random: 47d8314f250b74f5663e1628040643aa056d006b22bc545c…
            Session ID Length: 32
            Session ID: 66102923f52ed1561d19d32bbbc4836d6ba54bfc08e5103e…
            Cipher Suite: TLS_AES_256_GCM_SHA384 (0x1302)
            Compression Method: null (0)
            Extensions Length: 46
            Extension: supported_versions (len=2)
                Type: supported_versions (43)
                Length: 2
                Supported Version: TLS 1.3 (0x0304)
            Extension: key_share (len=36)
                Type: key_share (51)
                Length: 36
                Key Share extension
                    Key Share Entry: Group: x25519, Key Exchange length: 32
                        Group: x25519 (29)
                        Key Exchange Length: 32
                        Key Exchange: 4e0f39e1d9f34ce482ee1f12e4a6f0026b4d70df5def943f…
    TLSv1.3 Record Layer: Change Cipher Spec Protocol: Change Cipher Spec
        Content Type: Change Cipher Spec (20)
        Version: TLS 1.2 (0x0303)
        Length: 1
        Change Cipher Spec Message
    TLSv1.3 Record Layer: Application Data Protocol: Application Data
        Opaque Type: Application Data (23)
        Version: TLS 1.2 (0x0303)
        Length: 793
        Encrypted Application Data: 6083d7f1e990e0554af40ccf90ad0716eec3a10cc0b4d74d…
```

##### Server hello that client can handle
```
No.     Time           Source                Destination           Protocol Length Info
    354 4293.373488091 127.0.0.1             127.0.0.1             TLSv1.3  1031   Server Hello, Change Cipher Spec, Application Data

Frame 354: 1031 bytes on wire (8248 bits), 1031 bytes captured (8248 bits) on interface 0
Linux cooked capture
Internet Protocol Version 4, Src: 127.0.0.1, Dst: 127.0.0.1
Transmission Control Protocol, Src Port: 9200, Dst Port: 50452, Seq: 1, Ack: 518, Len: 963
Transport Layer Security
    TLSv1.3 Record Layer: Handshake Protocol: Server Hello
        Content Type: Handshake (22)
        Version: TLS 1.2 (0x0303)
        Length: 122
        Handshake Protocol: Server Hello
            Handshake Type: Server Hello (2)
            Length: 118
            Version: TLS 1.2 (0x0303)
            Random: 6e604e79a1c0cdcda2fbe91a21d86d3b32bd195e4b565f98…
            Session ID Length: 32
            Session ID: 6fe12d9a0a6e7157d7335293be3b895289d08f04431ea21a…
            Cipher Suite: TLS_AES_256_GCM_SHA384 (0x1302)
            Compression Method: null (0)
            Extensions Length: 46
            Extension: supported_versions (len=2)
                Type: supported_versions (43)
                Length: 2
                Supported Version: TLS 1.3 (0x0304)
            Extension: key_share (len=36)
                Type: key_share (51)
                Length: 36
                Key Share extension
                    Key Share Entry: Group: x25519, Key Exchange length: 32
                        Group: x25519 (29)
                        Key Exchange Length: 32
                        Key Exchange: 00d88691ec250e3be59ac044eed7b455d17bf1d2495ff5a6…
    TLSv1.3 Record Layer: Change Cipher Spec Protocol: Change Cipher Spec
        Content Type: Change Cipher Spec (20)
        Version: TLS 1.2 (0x0303)
        Length: 1
        Change Cipher Spec Message
    TLSv1.3 Record Layer: Application Data Protocol: Application Data
        Opaque Type: Application Data (23)
        Version: TLS 1.2 (0x0303)
        Length: 825
        Encrypted Application Data: b74c2510ae9bcfc8adb6fa048d814bfc7ffb69c3bfdd7c39…
```

the only difference is that the one that succeeds has a slightly bigger payload for Application Data, which might indicate that something is missing in the payload in the failing case. 
#### Client behavior 

##### Curl 

For curl, when failing , it fails with 
```
*   Trying 127.0.0.1:9200...
* TCP_NODELAY set
* Connected to localhost (127.0.0.1) port 9200 (#0)
* ALPN, offering h2
* ALPN, offering http/1.1
* successfully set certificate verify locations:
*   CAfile: none
  CApath: /etc/ssl/certs
* TLSv1.3 (OUT), TLS handshake, Client hello (1):
* TLSv1.3 (IN), TLS handshake, Server hello (2):
* TLSv1.1 (IN), TLS handshake, Certificate (11):
* TLSv1.1 (IN), TLS handshake, Server key exchange (12):
* TLSv1.1 (OUT), TLS alert, decrypt error (563):
* error:1416D07B:SSL routines:tls_process_key_exchange:bad signature
* Closing connection 0
curl: (35) error:1416D07B:SSL routines:tls_process_key_exchange:bad signature
```

while  a successful handshake looks like
```
*   Trying 127.0.0.1:9200...
* TCP_NODELAY set
* Connected to localhost (127.0.0.1) port 9200 (#0)
* ALPN, offering h2
* ALPN, offering http/1.1
* successfully set certificate verify locations:
*   CAfile: none
  CApath: /etc/ssl/certs
* TLSv1.3 (OUT), TLS handshake, Client hello (1):
* TLSv1.3 (IN), TLS handshake, Server hello (2):
* TLSv1.1 (IN), TLS handshake, Certificate (11):
* TLSv1.1 (IN), TLS handshake, Server key exchange (12):
* TLSv1.1 (IN), TLS handshake, Server finished (14):
* TLSv1.1 (OUT), TLS handshake, Client key exchange (16):
* TLSv1.1 (OUT), TLS change cipher, Change cipher spec (1):
* TLSv1.1 (OUT), TLS handshake, Finished (20):
* TLSv1.1 (IN), TLS handshake, Finished (20):
* SSL connection using TLSv1.1 / ECDHE-ECDSA-AES256-SHA
* ALPN, server did not agree to a protocol
* Server certificate:
*  subject: <subject DN was here>
*  start date: Mar 18 16:09:54 2020 GMT
*  expire date: Mar 18 16:09:54 2021 GMT
*  issuer: <issuer DN was here>
*  SSL certificate verify result: unable to get local issuer certificate (20), continuing anyway.
> GET / HTTP/1.1
> Host: localhost:9200
> User-Agent: curl/7.65.3
> Accept: */*
```

##### Openssl s_client

This offers an indication

Failed attempt: 
```
---
Certificate chain
 0 s:C = AU, ST = Some-State, O = Internet Widgits Pty Ltd, CN = localhost
   i:C = AU, ST = Some-State, O = Internet Widgits Pty Ltd, CN = localhost
---
Server certificate
-----BEGIN CERTIFICATE-----
MIICQzCCAcqgAwIBAgIUEqBCZK2/ev5HSDGUUxlo/09Wis4wCgYIKoZIzj0EAwMw
WTELMAkGA1UEBhMCQVUxEzARBgNVBAgMClNvbWUtU3RhdGUxITAfBgNVBAoMGElu
dGVybmV0IFdpZGdpdHMgUHR5IEx0ZDESMBAGA1UEAwwJbG9jYWxob3N0MB4XDTIw
MDQxMDA3NDk0OVoXDTIyMDQxMDA3NDk0OVowWTELMAkGA1UEBhMCQVUxEzARBgNV
BAgMClNvbWUtU3RhdGUxITAfBgNVBAoMGEludGVybmV0IFdpZGdpdHMgUHR5IEx0
ZDESMBAGA1UEAwwJbG9jYWxob3N0MHYwEAYHKoZIzj0CAQYFK4EEACIDYgAEQy3Z
C9lS5q593qQGpF8Ob0GDbQWN3lNkLcW+VdwQj2s4aw9XLR0vgjymCkEG7IaZ98O8
M6xrEu+bsQ5x3I7HK6zoiCV6OCidb9rRBvGK7hM0Fcxja6t1QvjpL1TeEgnUo1Mw
UTAdBgNVHQ4EFgQUNILtROSSq9Tp2rAxBCbXCUJEx2cwHwYDVR0jBBgwFoAUNILt
ROSSq9Tp2rAxBCbXCUJEx2cwDwYDVR0TAQH/BAUwAwEB/zAKBggqhkjOPQQDAwNn
ADBkAjBnVo8Mtv8yDQ/01UCvLDMQ8xnybVGDvRk2IOiyQPySbLos+WG+0McKoQWp
s8SoknwCMHLvajGF4LKA5U+0qApytEjp6O0qkTE+GzqnvXMRyE28bY8+tqcYHa1S
8r9dq8S+FA==
-----END CERTIFICATE-----
subject=C = AU, ST = Some-State, O = Internet Widgits Pty Ltd, CN = localhost

issuer=C = AU, ST = Some-State, O = Internet Widgits Pty Ltd, CN = localhost

---
No client certificate CA names sent
Server Temp Key: X25519, 253 bits
---
SSL handshake has read 929 bytes and written 300 bytes
Verification: OK
---
New, TLSv1.3, Cipher is TLS_AES_256_GCM_SHA384
Server public key is 384 bit
Secure Renegotiation IS NOT supported
Compression: NONE
Expansion: NONE
No ALPN negotiated
Early data was not sent
Verify return code: 0 (ok)
---
```

while the successful attempt contains: 

```
---
Certificate chain
 0 s:C = AU, ST = Some-State, O = Internet Widgits Pty Ltd, CN = localhost
   i:C = AU, ST = Some-State, O = Internet Widgits Pty Ltd, CN = localhost
---
Server certificate
-----BEGIN CERTIFICATE-----
MIICQzCCAcqgAwIBAgIUEqBCZK2/ev5HSDGUUxlo/09Wis4wCgYIKoZIzj0EAwMw
WTELMAkGA1UEBhMCQVUxEzARBgNVBAgMClNvbWUtU3RhdGUxITAfBgNVBAoMGElu
dGVybmV0IFdpZGdpdHMgUHR5IEx0ZDESMBAGA1UEAwwJbG9jYWxob3N0MB4XDTIw
MDQxMDA3NDk0OVoXDTIyMDQxMDA3NDk0OVowWTELMAkGA1UEBhMCQVUxEzARBgNV
BAgMClNvbWUtU3RhdGUxITAfBgNVBAoMGEludGVybmV0IFdpZGdpdHMgUHR5IEx0
ZDESMBAGA1UEAwwJbG9jYWxob3N0MHYwEAYHKoZIzj0CAQYFK4EEACIDYgAEQy3Z
C9lS5q593qQGpF8Ob0GDbQWN3lNkLcW+VdwQj2s4aw9XLR0vgjymCkEG7IaZ98O8
M6xrEu+bsQ5x3I7HK6zoiCV6OCidb9rRBvGK7hM0Fcxja6t1QvjpL1TeEgnUo1Mw
UTAdBgNVHQ4EFgQUNILtROSSq9Tp2rAxBCbXCUJEx2cwHwYDVR0jBBgwFoAUNILt
ROSSq9Tp2rAxBCbXCUJEx2cwDwYDVR0TAQH/BAUwAwEB/zAKBggqhkjOPQQDAwNn
ADBkAjBnVo8Mtv8yDQ/01UCvLDMQ8xnybVGDvRk2IOiyQPySbLos+WG+0McKoQWp
s8SoknwCMHLvajGF4LKA5U+0qApytEjp6O0qkTE+GzqnvXMRyE28bY8+tqcYHa1S
8r9dq8S+FA==
-----END CERTIFICATE-----
subject=C = AU, ST = Some-State, O = Internet Widgits Pty Ltd, CN = localhost

issuer=C = AU, ST = Some-State, O = Internet Widgits Pty Ltd, CN = localhost

---
No client certificate CA names sent
Peer signing digest: SHA384
Peer signature type: ECDSA
Server Temp Key: X25519, 253 bits
---
SSL handshake has read 962 bytes and written 373 bytes
Verification: OK
---
New, TLSv1.3, Cipher is TLS_AES_256_GCM_SHA384
Server public key is 384 bit
Secure Renegotiation IS NOT supported
Compression: NONE
Expansion: NONE
No ALPN negotiated
Early data was not sent
Verify return code: 0 (ok)
---
```

It looks like it can recognize that the certificate signature is `ECDSA` with `SHA384`
```
Peer signing digest: SHA384
Peer signature type: ECDSA
```

while in the unsuccessful attempt, this information is missing and this might cause the `bad signature` error we see ( the client doesn't have the information about the signature that it is presented with and thus can't verify it )
